{
  "area": "headings",
  "expected": {
    "customAnchors": [],
    "diagrams": [],
    "headings": [],
    "images": [],
    "links": [],
    "renderedBodyHtml": "\u003Ctable\u003E\n\u003Cthead\u003E\n\u003Ctr\u003E\n\u003Cth\u003EA\u003C/th\u003E\n\u003Cth\u003EB\u003C/th\u003E\n\u003C/tr\u003E\n\u003C/thead\u003E\n\u003Ctbody\u003E\n\u003Ctr\u003E\n\u003Ctd\u003E1\u003C/td\u003E\n\u003Ctd\u003E2\u003C/td\u003E\n\u003C/tr\u003E\n\u003C/tbody\u003E\n\u003C/table\u003E\n"
  },
  "input": {
    "markdown": "| A | B |\n| - | - |\n| 1 | 2 |\n"
  },
  "name": "tables",
  "schemaVersion": "marknexia-parity-v1",
  "sourceRevision": "d976711b0da9b878fc57947b963b417be909ba92",
  "virtualFileSystem": null
}
