{
  "area": "headings",
  "expected": {
    "customAnchors": [],
    "diagrams": [],
    "headings": [],
    "images": [],
    "links": [],
    "renderedBodyHtml": "\u003Cp\u003E\u003Cdel\u003Edeleted\u003C/del\u003E \u003Cmark\u003Emarked\u003C/mark\u003E\u003C/p\u003E\n"
  },
  "input": {
    "markdown": "~~deleted~~ ==marked==\n"
  },
  "name": "emphasis-extras",
  "schemaVersion": "marknexia-parity-v1",
  "sourceRevision": "2931037abd86d02fca258d61c9171cf451d482e2",
  "virtualFileSystem": null
}
