{
  "area": "navigation",
  "expected": {
    "fileSystemProbeCount": 1,
    "intent": {
      "diagnostic": null,
      "externalUri": null,
      "fragment": "overview",
      "isSafe": true,
      "kind": "CrossDocumentWithAnchor",
      "targetDocument": "C:/repo/docs/api.md#overview"
    }
  },
  "input": {
    "currentFile": "C:/repo/README.md",
    "destination": "file:///C:/repo/docs/api.md#overview",
    "policy": {
      "allowExternalLinks": true,
      "allowRemoteAssets": false,
      "enforceRepositorySandbox": true
    },
    "repositoryRoot": "C:/repo"
  },
  "name": "positive-absolute-local",
  "schemaVersion": "marknexia-parity-v1",
  "sourceRevision": "38b39f668ce52026261ac4802602c0cf7e0711a3",
  "virtualFileSystem": {
    "files": [
      "c:/repo/README.md",
      "c:/repo/docs/api.md"
    ],
    "root": "C:/repo"
  }
}
