{
  "area": "update-archives",
  "expected": {
    "exception": "InvalidDataException",
    "message": "The update archive is larger than the supported limit.",
    "outcome": "rejected",
    "pendingStageDirectories": 0,
    "preExistingStageStillExists": false
  },
  "input": {
    "archiveBytesBase64": "UEsDBBQAAAAAAAAAAAAAAAAAAAAAAAAAAAANAAAAb3ZlcnNpemVkLmJpblBLAQIUABQAAAAAAAAAAAAAAAAAAAAAAAHKmjsNAAAAAAAAAAAAAAAAAAAAAABvdmVyc2l6ZWQuYmluUEsFBgAAAAABAAEAOwAAACsAAAAAAA==",
    "checksumMatches": true,
    "checksumText": "79cf6a499d0cb9980b84d9e6e72535918ba37299d64291b9300e1b256663a3f6  package.zip\\n",
    "maximumExpandedBytes": 1000000000,
    "packageBytes": 124,
    "packageEntries": [
      {
        "contentBase64": null,
        "declaredUncompressedBytes": 1000000001,
        "path": "oversized.bin"
      }
    ],
    "preExistingStage": null
  },
  "name": "expansion-limits",
  "schemaVersion": "marknexia-parity-v1",
  "sourceRevision": "5ff161b0a18d8cbc4625311b707f24daf5a6bffa",
  "virtualFileSystem": {
    "files": [],
    "root": "updates"
  }
}
