{
  "area": "update-archives",
  "expected": {
    "exception": "InvalidDataException",
    "message": "The downloaded update checksum does not match.",
    "outcome": "rejected",
    "pendingStageDirectories": 0
  },
  "input": {
    "checksumMatches": false,
    "maximumExpandedBytes": 1000000000,
    "packageBytes": 480,
    "packageEntries": [
      "Marknexia.App.exe",
      "Marknexia.App.dll",
      "Marknexia.App.pri",
      "marknexia-sbom.spdx.json"
    ]
  },
  "name": "checksum-mismatch",
  "schemaVersion": "marknexia-parity-v1",
  "sourceRevision": "d976711b0da9b878fc57947b963b417be909ba92",
  "virtualFileSystem": {
    "files": [],
    "root": "updates"
  }
}
