{
  "area": "sanitizer",
  "expected": {
    "sanitizedHtml": "\u003Cimg src=\u0022#\u0022\u003E"
  },
  "input": {
    "html": "\u003Cimg src=\u0022vbscript:msgbox(1)\u0022\u003E",
    "mode": "html"
  },
  "name": "unsafe-uri",
  "schemaVersion": "marknexia-parity-v1",
  "sourceRevision": "978483037d8042f18f19df39e1ce70f36d10fdd0",
  "virtualFileSystem": null
}
