{
  "area": "update-archives",
  "expected": {
    "exception": "InvalidDataException",
    "message": "The update archive contains a path traversal entry.",
    "outcome": "rejected",
    "pendingStageDirectories": 0,
    "preExistingStageStillExists": false
  },
  "input": {
    "archiveBytesBase64": "UEsDBBQAAAAAAAAAIVAb3wWlAQAAAAEAAAAOAAAALi4vZXNjYXBlZC50eHQBUEsBAhQAFAAAAAAAAAAhUBvfBaUBAAAAAQAAAA4AAAAAAAAAAAAAAAAAAAAAAC4uL2VzY2FwZWQudHh0UEsFBgAAAAABAAEAPAAAAC0AAAAAAA==",
    "checksumMatches": true,
    "checksumText": "0f7b95b92feda1687063ebf3a7819c36ee49828bf0afcf219eb640210cdb526a  package.zip\n",
    "maximumExpandedBytes": 1000000000,
    "packageBytes": 127,
    "packageEntries": [
      {
        "contentBase64": "AQ==",
        "declaredUncompressedBytes": 1,
        "path": "../escaped.txt"
      }
    ],
    "preExistingStage": null
  },
  "name": "archive-traversal",
  "schemaVersion": "marknexia-parity-v1",
  "sourceRevision": "38b39f668ce52026261ac4802602c0cf7e0711a3",
  "virtualFileSystem": {
    "files": [],
    "root": "updates"
  }
}
