{
  "area": "headings",
  "expected": {
    "customAnchors": [],
    "diagrams": [],
    "headings": [],
    "images": [],
    "links": [],
    "renderedBodyHtml": "\u003Cul class=\u0022contains-task-list\u0022\u003E\n\u003Cli class=\u0022task-list-item\u0022\u003E\u003Cinput disabled=\u0022disabled\u0022 type=\u0022checkbox\u0022 checked=\u0022checked\u0022 /\u003E done\u003C/li\u003E\n\u003Cli class=\u0022task-list-item\u0022\u003E\u003Cinput disabled=\u0022disabled\u0022 type=\u0022checkbox\u0022 /\u003E todo\u003C/li\u003E\n\u003C/ul\u003E\n"
  },
  "input": {
    "markdown": "- [x] done\n- [ ] todo\n"
  },
  "name": "task-lists",
  "schemaVersion": "marknexia-parity-v1",
  "sourceRevision": "5ff161b0a18d8cbc4625311b707f24daf5a6bffa",
  "virtualFileSystem": null
}
