{
  "area": "headings",
  "expected": {
    "customAnchors": [],
    "diagrams": [],
    "headings": [],
    "images": [],
    "links": [],
    "renderedBodyHtml": "\u003Cp\u003ENote.\u003Ca id=\u0022fnref:1\u0022 href=\u0022#fn:1\u0022 class=\u0022footnote-ref\u0022\u003E\u003Csup\u003E1\u003C/sup\u003E\u003C/a\u003E\u003C/p\u003E\n\u003Cdiv class=\u0022footnotes\u0022\u003E\n\u003Chr /\u003E\n\u003Col\u003E\n\u003Cli id=\u0022fn:1\u0022\u003E\n\u003Cp\u003Efootnote\u003Ca href=\u0022#fnref:1\u0022 class=\u0022footnote-back-ref\u0022\u003E\u0026#8617;\u003C/a\u003E\u003C/p\u003E\n\u003C/li\u003E\n\u003C/ol\u003E\n\u003C/div\u003E\n"
  },
  "input": {
    "markdown": "Note.[^1]\n\n[^1]: footnote\n"
  },
  "name": "footnotes",
  "schemaVersion": "marknexia-parity-v1",
  "sourceRevision": "38b39f668ce52026261ac4802602c0cf7e0711a3",
  "virtualFileSystem": null
}
