{
  "area": "headings",
  "expected": {
    "customAnchors": [],
    "diagrams": [
      {
        "DiagramType": "mermaid",
        "Id": "mermaid-1",
        "LineNumber": 0,
        "SourceCode": "graph TD\r\nA--\u003EB"
      }
    ],
    "headings": [],
    "images": [],
    "links": [],
    "renderedBodyHtml": "\u003Cpre\u003E\u003Ccode class=\u0022language-mermaid\u0022\u003Egraph TD\nA--\u0026gt;B\n\u003C/code\u003E\u003C/pre\u003E\n"
  },
  "input": {
    "markdown": "\u0060\u0060\u0060mermaid\ngraph TD\nA--\u003EB\n\u0060\u0060\u0060\n"
  },
  "name": "mermaid-block",
  "schemaVersion": "marknexia-parity-v1",
  "sourceRevision": "d976711b0da9b878fc57947b963b417be909ba92",
  "virtualFileSystem": null
}
